comment_no,comment,pol_score,subj_score
2,"i’m halfway through season 2. season 1 was fairly straightforward, but season 2 is starting to focus on some fantasy aspects…dragons, demons, etc. as i continue to watch, am i to believe that the dragons are real in this world? the demons are real in this world? anything else i come across are real?

or should i watch with the idea that this story is being retold 100ish years after the events of the show and that liberties have been taken by the story teller…adding in dragons, demons, etc to spice up the story?",0.19499999999999998,0.275
9,"watching got for the first time. i’m in season 1 and think the quality is actually quiet good. but it could be better i think. will it improve? 

(quality = cgi and stuff like that i’m not talking about the content)",0.3625,0.44166666666666665
21,"hi, i just recently started asoiaf and i’m a few hundred pages into a clash of kings. i’ve begun watching season 1 of the show and it seems to only really follow agot. for the other seasons, which ones cover the material in which books?",-0.025,0.385
118,"i was trying to make a list of characters who appeared in season 1 episode 1 ""winter is coming"" who survived all the way to the end.

the ones i can think of:

jon snow/aegon targaryen* 

sansa stark 

arya stark 

tyrion lannister 

ghost

nymeria

*died and came back 

can anyone add to this?",-0.13333333333333333,0.39999999999999997
124,i feel like i am the only one who really likes season 7. it is not my favorite i like season 1 and 4 better but season 7 gets a ton of hate idk why? (i dont like season 8),0.15,0.7666666666666666
133,"i am now rewatching the series after so many years. in season 1 episode 1, why do you think that the white walker let that guy that ned beheaded live and escape? since he killed the other crows. anyone read the books that can maybe explain?",0.06227272727272727,0.275
148,"hi all! i recently finished writing my own six episode season 8. it was purely for fun and to spend time in the world of got; i'm a huge fan (my left arm is covered in tattoos of house sigils) but like a lot of people i was really disappointed (to put it mildly!) with the final season we got. i like to think my scripts put right a lot of the major issues, but also take things in interesting and surprising directions. very few of the characters end up where they did in the show proper.

i'm currently working on the idea of recording the scripts as a radio play and putting them online as a podcast. 

long story, short, i'd love to hear from anybody that might have an interest in providing one or potentially multiple character voices. if so, please do let me know you age/sex/accent etc and if there's anyone in particular you think you'd be a good fit for. *just to be totally clear, this is just a bit of fun (hopefully) between fans, so there's no remuneration or professional credits involved.* if there is interest, i can move forward with the logistics of recording/editing etc, and if there's not, well, i'll be happy to just go back to writing my robert's rebellion prequel series (season 1 available on reddit, if anyone's interested or wants to get a sense of my writing before expressing interest in the radio play of season 8).

**tldr: anyone fancy doing a little acting and providing a voice for a got radio play podcast?**

thanks for reading!",0.1970952380952381,0.4223537414965986
205,"let me talk a few

1.even if catelyn died, she didn't know that her beloved ned stark was only loyal to her all his life.

2.king joffrey

be engaged to the most beautiful northern girl

marry the most beautiful southern girl

still a virgin when he died

3.in any way you kill others, you will die in the same way. (not a fixed rule)

1) in the first episode of the first season, ned beheaded the so-called ""great wall deserter"", so ned was also beheaded in the same season.

others will be updated in the future",0.26960784313725494,0.501470588235294
248,"
so i just started the show, loving it so far, what i don’t understand is the exact nature of relationship between the lannister family and king robert. why did king robbert marry cersei lannister? why did they kill the hand of the king if he was going to be replaced anyway? is it not them that want power. why did jaime kill the previous king so robert could become king? i’m only on the 3rd episode in season 1 so just tell me what would be okay without spoilers or if show explains all this later.",0.16041666666666665,0.48333333333333334
253,"rules

1. i'm counting jamie with both hands
2. has to be alive as of season 1 so no arthur dayne
3. i'm not going to do young barristan selmy because he was an old man as of season 1 or prime robert baratheon because he was fat as of season 1.

[view poll](https://www.reddit.com/poll/pctn7q)",0.10000000000000002,0.3333333333333333
253,"rules

1. i'm counting jamie with both hands
2. has to be alive as of season 1 so no arthur dayne
3. i'm not going to do young barristan selmy because he was an old man as of season 1 or prime robert baratheon because he was fat as of season 1.

[view poll](https://www.reddit.com/poll/pctn7q)",0.10000000000000002,0.3333333333333333
253,"rules

1. i'm counting jamie with both hands
2. has to be alive as of season 1 so no arthur dayne
3. i'm not going to do young barristan selmy because he was an old man as of season 1 or prime robert baratheon because he was fat as of season 1.

[view poll](https://www.reddit.com/poll/pctn7q)",0.10000000000000002,0.3333333333333333
266,"you only really ever hear people talk about blackwater, but this season is amazing to me. tyrion is at his absolute best, he owns everyone and it’s amazing. we get to see just how awful joffrey is, we saw it in season 1 but this season he’s turned up a notch. 

we see robb winning his battles, introduced to brienne,  melissandre, stannis, davos, and many other great characters. the stuff beyond the wall is great. 

we also see arya and tywin, the duo we didn’t know we needed. every one of their scenes together is gold. 

my biggest hot take is quarth. people say it’s weird, but i seriously really liked it. it’s so different from everything else we see in got, and i really enjoyed all the weird people we get to meet there. 

what do you guys think?",0.24583333333333332,0.7374999999999999
385,"i've only two seasons left and i'm excited although i heard the finale was disappointing and had something to do with a dragon.

 i didn't except jon to come back, we've only had 1 fake out death and the character wasn't even major (leader of the brothers without banners) when an important character was dying like robb who was less injured then jon they didn't survive so to see him come back was a great surprise. 

cersi continues to manipulate tommen and it's crazy how she can't see how it's wrong. her redeeming quality is supposed to be how she loves her children but she doesn't.

cersi keeps talking for tommen and it gets more and more annoying everytime. i was starting to like jamie but because she's in cersi's pocket i'm starting not to like him. 

i hate the religious fanatics but i love that they're hurting the lannisters (really just cersi)

when will the lannisters go after dorne? cersi won't let them get away with her daughters murder. 

summer just died leaving only 2 dire wolves, ghost and arya's that ran off in the first season. 

the dead running through the tunnel is probably the coolest scene so far 

 i liked hodor, hoped he'd be one of the few to actually make it. 

bran us responsible for hodors disability, i wonder what he'll say about it

the dothraki coming up on the harpy's was an awesome sight

i hope to god that jon doesn't lose to the boltons. they've won twice already (against theon and stannis) and i hope they won't win a third. 

will jon and ramsay fight 1v1 and who will win if they do?

i would love to see ramsay and tormund fight at least verbally, compare their brutality and insanity

i feel like someone on the stark team will die, i think it's between davos, tormund, and rickon. maybe sansa but i think the rest are more likely

tormund is awesome (apart from all the raping, murdering, and every other crime) i think they're showing us how cool is he is because he's going to die. but at the same time davos us walking away from camp, maybe he'll get killed while on his walk. 

sometimes we get a hint at what'll happen, i don't think there was one this time

why hasn't the red woman tried to fuck jon again to make another demon shadow to kill ramsay? jon has kings blood in him like stannis and the blacksmith they were going to kill. 

i wonder if tyrion will die at all and if so how will he go out?

holy shit, the bolton army is huge, jon doesn't stand a chance. i really hope this won't be the slaughter it looks like it'll be. who will help jon last second, will it be the river run forces with brienne and pod? maybe sansas cousin will send his forces, whoever comes to help i hope they do it quickly

rickon is about to be killed by ramsay's dogs, he'll run and they'll chase (ramsay was just handed a bow so nevermind)

 the first stark child falls, who will be next?

jon reminds me of captain america, standing against impossible odds but still not giving up

jon fighting on the front line vs ramsay hiding behind his men really shows the difference in their leadership

i would love to see ramsay received similar torture to what he did to theon, he deserves worse but i don't see jon doing it, maybe sansa will

i hated cersi and wanted to see her die more than anything but now i'm hoping the faith will be slaughtered for their manipulation 

all of cersi's children are dead, will the starks meet the same fate?

daenerys says she wants to rule the seven kingdoms, does that mean she wants to sit on the iron throne only or that she wants to rule all of westros? i hope that she doesn't go to war with the starks. 

i don't think cersei knew tommen would kill himself otherwise why have the mountain prevent him from going to the trial but things have worked out in her favor almost like she planned for it all

so far the starks have stayed my favorite, i wish we had more time with rickon, we've come to know every stark child except for him and now we never will

when i finish season 8 i'll leave a ranking of my favorite characters throughout the whole series.",0.06898734177215188,0.5083860759493671
388,"here’s mine:

1. season 4, all around great arcs and storylines for each of the characters, it’s difficult to find something to complain about with this season

2. season 6, great payoffs for the characters and i especially liked battle of the bastards and the end with daenerys and the ships

3. season 1, really great start to the show and amazing way to establish how the show is gonna work with killing the “main” character very early on

4. season 2, very dense season with a lot of things happening, most is very entertaining to watch even thought the dense-ness of the season causes it to feel just a little sloppy

5. season 3, i never really liked half of the storylines especially with robbs feeling very slow until the amazing red wedding however, half of the storylines were great especially with the writers finally finding something to do with bran

6. season 5, ugh, it’s the same snakes, other than them the season was…alright, it kinda felt like the fever dream of got seasons to me

7. season 7, i enjoyed daenerys finally getting to westeros but it felt like a lot of the shows consistency was disappearing and characters arcs were making less and less sense

8. season 8, instead of ranting about the bad parts of season 8 like almost everyone else on earth, i’ll say the good parts about season 8, it had good cgi…theons arc was…okay

what’s your ranking?",0.1772311827956989,0.6130107526881722
421,"doing my first rewatch of the show with a friend who has never seen it before.  i decided to rank the episodes as we go.  just finished season 1.

1. s1e3 - lord snow
2. s1e1 - winter is coming
3. s1e10 - fire and blood
4. s1e9 - baelor
5. s1e6 - a golden crown
6. s1e8 - the pointy end
7. s1e4 - cripples, bastards, and broken things
8. s1e5 - the wolf and the lion
9. s1e7 - you win or you die
10. s1e2 - the kingsroad

to be clear i like every episode in this season.",0.04166666666666666,0.4861111111111111
435,"in the first season of the show, jon snow becomes incredibly angry as he is elected a steward in place og a ranger, and notably says something like thid to samwell tarly: ""this is ser allisers work; he wanted revenge, and he got it."" in addition to this, there is actually a short cut showing ser alliser looking pretty smug. however, as we later found out, the old bear wanted jon as his steward and squire in order to groom him for command. 

my question is then: was ser alliser aware of mormont's plan, and if so, why did he look so amused by it? i feel like he at least was aware of  jon becoming a steward, cuz he instantly smiled at jon once his name was called.",0.15416666666666667,0.4402777777777778
453,"i was seeing the first season again and i remembered of the ilyn payne. what happened to him? i don’t remember if he dies or something else, does anyone knows?",0.25,0.3333333333333333
464,"sources tell something different in my language.

i read that one season equals one year in the series. and i read that loras said in season 1, that tommen was 8 years old. that would mean that tommen was 14 when he died in season 6.

a different source - a wiki in my language - wrote that tommen was 19 in season 6. i can not imagine that.

i find it weird because other guessings of the age seemed to be pretty acurate, telling that for example bran was 17 in season 8 or that margaery was 14 at the beginning of the series (meaning she was 20 in season 6). 

is there any reliable source to tell about the age of the characters?

greetings!",-0.075,0.6375000000000001
490,"just wanna say that i am finally watching got for the first time and fortunately i have not had anything major spoiled for, or ateast nothing that i remember and i am in love with it so far. i am done with season 1 and only 2 episodes into season 2.

what i would like to know is if its worth going all the way through or not. i've heard plenty of people say that the season 7 and 8 ruined the whole thing for them, especially 8, and i was curious if you think it is worth watching until the end or should i just stop after season 6 and leave it at that. 

thanks!",0.17403846153846153,0.6102564102564102
516,"i won't say im an avid fan, but i genuinely interested in this series. at the end of season 1 and want to read the books, but the glaring question is if george r r martin will finish the books. he's an old man. he's 72 and if his books take years to finish i wonder if the man himself will be able to finish before he's 80. hell, im surprised he's still alive. 

so the bigger question here is who will finish the books if martin dies? will they remain unfinished or will there be someone to carry the torch?",0.18571428571428575,0.5892857142857143
551,"i am rewatching game of thrones for the first time in many years, so i may have forgotten if this is explained. i am on the first episode of season 5 when tyrion and varys arrive at illyrio mopatis’s estate in essos. varys explains he is part of a group working to restore the targaryens to power, but in season 1 varys was actively encouraging daenerys  assassination during robert’s small council meeting? is this just varys’s self preservation and pretending? i know he was seen talking to illyrio in the catacombs by arya but i don’t remember their convo. sorry if this is a dumb question, i literally paused the episode to come make this post so it may be explained at some point, if it is i apologize.",-0.08229166666666667,0.5083333333333333
574," hello i have recently joined and i've been wondering about the night king or kings... it is known that in the first long night millenia ago the night king was defeated by azor ahai, the prince who was promised with his flaming sword, that implies that he killed him right? so if tnk was defeated right? if so how is he back again in season 1 to do the same thing all over again? is he a different night king or was he ever actually defeated? and if so what happened?",0.05714285714285714,0.2879761904761905
631,"so i've been watching got with my family on blu-ray, and i've noticed some scenes are missing. we've only watched season 1 so far but the missing scenes are:

the hound v. the mountain after gregor kills his own horse.

jamie v. ned were after ned gets stabbed in the leg with a spear.

tyrion beating a man to death with his shield.

so far the missing scenes all involve pretty gorey death. could this be the reason they weren't included?",0.05624999999999999,0.6437499999999999
645,"
1. season 6 (action packed and actual good writing with insane dialogue and subplots)
2. season 7 (good action w good plots, this was where all main character started interacting with each other so it was really cool to see)-this season is way too hated on, if no one read everyone else's opinions and got influenced i feel like this season would get sm more love
3. season 4 (series finally started to pick up in pace and everything somewhat started connecting, subplots and dialogue were also at a peak, something interesting was constantly happening)
4. season 3 (ok season don't even remember key scenes from here other than insane ending)
5. season 1 and 2 (not the best seasons, quite uninteresting with only 2-3 exceptional episodes per season. was all over the place making new viewers confused. too many subplots happening at once for new viewer which can get irritating)
6. season 5 (average joe season, not much action, little to no advancement in sub plots. stannis literally stayed in north for like 4 episodes doing nothing😭😭, wildlings coming together with jon snow was lit tho) 
7. season 8 (although entertaining the writing and conclusion was sooooo bad, was cool to see everyone come together and work along each other's side but y'all already know how bad the writing was and how rushed everything was)",0.06232112794612796,0.5620580808080808
684,i’m re-watching it during my holidays and all i’m getting pissed off by how much of a bitch she is. i somehow didn’t notice this before on my first watch. i know she gets treated very badly and no woman deserves that treatment. but sansa in season 1 really is a bitch.,-0.06499999999999995,0.39999999999999997
740,"in season 2 we see robb marry talisa but instead of the  wedding being under the old gods, they say the words for the seven. also where in the end of season 1 or beginning of season 2 lord karstark says ""i swear to the father..."" another reference to the seven.

was this just a mistake on the writers part or was there a reason for this?",0.1,0.2
770,"i just watched game of thrones over lockdown. i have recently fell down a rabbit hole of clips, interviews and scenes of youtube. i came across some of the deleted scenes and one of them is from season 1 or 2 of the hound and sansa where the hound is downright creepy. it seemed a bit off but apparently he acts like that in the books. i also saw that apparently people ship the hound and sansa, and it’s not a small few. where does that come from? is there any truth to it, either side? genuinely curious, i could kinda get feelings from one side in certain scenes but shipping it, don’t think that would work and that’s not even considering she’s half his age and a minor. if there is any shippers out there, i’d just like to know what’s the deal with it. thanks",-0.07176434676434676,0.405921855921856
795,"i'm about to start watching got for the very first time after hearing all the hype about it for a decade. i own the first book but never got around to reading it so i'm going in as blind as i possibly can after hearing everyone freak out about it for 10 years and inevitably spoiling me along the way. i'm doing this after finally watching breaking bad and better call saul for the first time recently as well, and i loved both of those. i do have a few questions, though.

1. should i watch the last few seasons?

i've heard a lot of people say that season 7 and 8 weren't that good, and that the ending sucked, so im wondering if i should watch. i expect the answer to be that yes, i should, but i should expect to be disappointed.

2. how bad/good are the last few seasons?

3. if i don't watch the last few season is there somewhere i should stop?

4. i've heard season 5 is the first season that starts to diverge from the books a bit. is that true?",0.05108695652173914,0.4746376811594203
897,"first off i'll start by saying yes i know it's a show. but man season 1 is so frustrating. honestly most of the bloodshed throughout the series could have just been avoided if ned went along with renly and littlefinger. renly said he could have gotten 100 men, whether that was his or his and loris tyrell's. littlefinger could have delivered the gold cloaks and not betrayed ned. once they seized joffery, ned could have played along until stannis arrived back in the capitol and then ned could have turned over the kingdoms to him. 

you'd probably still have a war with the lannisters but at least ned wouldn't of been beheaded, and the red wedding wouldn't have happened. 

i really hate they killed ned off so quickly and i wish there was an alternate series where it played out like this. in general there's a lot of things about the show that i wish went differently such as the whole army of the dead and dragons storylines. i never cared too much about them.

another part of the show that's insanely frustrating to watch for me is rickon's death. why tf did this dumb mfer run in a straight ass line while they shoot arrows at him and he can see them landing right next to him. like tf you doing, zig and zag bitch.

edit: another scene that frustrates me is when the lannisters come for arya after king robert dies. why tf didn't serio just pick up one of the swords from the dudes he just beat. a lot of dumb people in the got world. if you grabbed a sword he may have been able to kill the kingsguard but noooo let's use that oversized toothpick as a weapon.",-0.02413419913419913,0.40882034632034636
904,i read the first book and it is nearly identical to the shows 1st season. i mean some of the dialog is spot on. it does flesh out the background a bit more but i was hoping for more than the shows had to offer. do the other books branch off or offer anything totally different than the show?,0.13035714285714287,0.4851190476190476
