comment_no,comment,pol_score,subj_score
908,"i watched the show in real time as it aired, which was difficult as by the latter seasons i had forgotten a lot of the details of the early seasons. the end was a shock and disappointment to me as it was to many.

but then i re-watched the series within a couple of months and the continuity of the story and characters held up much better in the re-watch. yes, it's true, certain things seemed rather far-fetched, such as varys throwing his normal caution to the wind, but by and large the main problem i'd had with the show in the first viewing was drastically reduced.

dany's nature doesn't really change throughout the show. if you re-watch it you will see dany as the ruthless tyrant she is destined to become, even in the earlier seasons. like most tyrants, she is generous and kind to those who are faithful and obedient to her. in the early seasons, when she kills people, we are rooting for her because we think the people she's killing suck.

the assault on king's landing episode is actually quite powerful if you look at it and ignore dany. the fact that the northerners turn into murdering rapists is more interesting and sad than anything dany does - it shows the true horror of warfare. they're supposed to be the good guys.

and this episode is the one time that i find dany acts out of character and it makes little sense. everything she does up to the ringing of the bells is fine and consistent with her character. was the writing as good in season 8 as season 1-4? no. but dany's character consistency is mostly fine. up to the ringing of the bells.

cercei and her army were backstabbers. dany and her army literally saved the world and cercei sat there and waited to stab them in the back. it would be like - imagine aliens attacked earth and, like a hollywood movie, the usa tried to rally the world's militaries in defense. imagine the major powers agreed to put aside their differences and fight the aliens together. imagine it's a brutal war with astronomical casualties, but we somehow pull it off. except one country, china, decided to sit the war out and build up their army, and when the aliens are finally defeated china goes on a rampage and  invades the usa. it would be the most evil thing a nation has ever done in the history of our species. by sitting the war out for their own personal gain, they would have put the entire human species in jeopardy. i would consider it the worst betrayal in history, the worst crime.

this is what cercei does. the army of the dead seems to be about to exterminate all life and it seems the night king will win, and yet dany fights against him despite the odds, and cercei uses the events to her advantage. it's a truly evil betrayal and cercei and the entire lannister army deserve to be vaporized by dragonfire. the golden company too.

so dany flying around and nuking the shit out of the army makes sense. if she had completely blown up the red keep that would make sense too. ~~but why does she take her time flying up and down the streets to burn the irrelevant peasants running away? that makes no sense.~~

~~she's trying to conquer the city, to live in it, to sit on the throne. it makes no sense for her to turn it to ash first. she's not even getting revenge on anyone at that point. it would even make more sense for her to burn down casterly rock, or blow up the iron bank. the city of king's landing has been her dream her whole life. burning it and all the people within it is unexplainable.~~

~~and that scene, where she takes off after the bells ring, looking at the red keep... and then spends hours burning everything other than the red keep - that makes no sense.~~

i've read the explanations offered in this thread and i thought about the dialogue in the last episode more and yes, even dany's burning of kl does make sense and is consistent with her character. i think most of us still agree it was a dick move of d&d to condense the final two seasons and this descent into genocide should have been given more than one episode, but ultimately it is consistent with dany's previous path/trajectory. ",0.06891885121051787,0.5171682098765432
942,"hello all! i grew up in a conservative family, so i missed out of the whole got series excitement when it was still airing. i heard a couple of things about the show over the years and yesterday i decided to watch it! 

i’m on season 1 episode 3 and i learned that you probably shouldn’t watch this show while exercising at the gym (episode 2 with khaleesi and drogo👀)

i was wondering should i skip the last season because of all of the hate it received? or did anyone enjoy the last season? sorry if this is a sensitive topic!
edit: dumb autocorrect changed drogo to diego haha",-0.07777777777777778,0.5148148148148148
1032,"i think ned was a great character for season 1 because he encapsulated a lot of what the audience was feeling/thinking and introduced us to the game of thrones. 

i didn’t read the books so right up until his execution, i trusted everyone and everything they said. i gave myself whiplash trying to figure out who was honest/trustworthy and who wasn’t. and right up until his execution i was waiting for him to somehow miraculously save himself. his death really showed the audience (at least me), that this was serious. 

when cersei said “in the game of thrones you either win or die” i almost laughed at how ridiculous that line sounded, but in hindsight it was probably the truest thing she ever said.",0.11861471861471862,0.4989177489177489
1107,"i can't remember them lowering a crown onto his head. but just rewatch the episode where they declared him king. the scene, if it exists, should be in there. episode 10, season 1.",0.0,0.0
1187,"season ranking imho: 3, 2, 4, 1, 5, 6, 7, 8.

if you liked season 1, you'll love 2, 3, and 4.",0.5333333333333333,0.7999999999999999
1284,"all you need to know is don't watch season 8. trust me, you're better off ending on a cliff hanger compared to what we actually got. season 1-4 and 6 are amazing though, you'll enjoy those.",0.375,0.5
1291,pay more attention to season 1-7,0.5,0.5
1446,"season 1 - a game of thrones

season 2 - a clash of kings

seasons 3 & 4 - a storm of swords

season 5 - a feast for crows & a dance with dragons (very loosely based)

seasons 6-8: grrm's notes from the winds of winter & a dream of spring",-0.25,0.375
1615,"season 1 and 2 pretty much follow the got and cok exactly. 

season 3 and 4 are based on sos. 

season 5 and 6 are loosely based on ffc and dwd. 

season 7 and 8 are based on notes grrm gave d&d.",0.15576923076923077,0.4298076923076923
